{"schemaVersion":1,"requestId":"fixture-request","mapId":"fixture-map","displayName":"Fixture","designPurpose":"test","chapterRole":"test","sourceType":"original","targetViewport":{"width":960,"height":1800},"cameraModel":"top-down","gameplayCorridor":{"x":0,"y":0,"width":1,"height":1},"safeZones":[{"x":0,"y":0,"width":1,"height":0.1}],"themeKeywords":["test"],"backgroundIntent":"test","canonicalElements":[],"newElementProposals":[],"motionIntent":"none","prohibitedChanges":["gameplay"],"provenance":{"provenanceId":"fixture-art","provenanceHash":"f33a5177f1556074a347fe578b3a8bbcb3329fcad6f7524c8a3e536046c63b40"}}
